{
  "schemaVersion": 1,
  "culture": "xx-XX",
  "languageName": "Your language in English",
  "nativeName": "Your language in its native form",
  "author": "Your name",
  "appVersion": "0.2.0",
  "strings": {
    "Matrix.SelectAll": "Chọn tất cả",
    "Matrix.CopyGrid": "Sao chép bảng",
    "Matrix.CopyHelp": "Chạm ô # ở góc bảng hoặc Ctrl+A để chọn tất cả. Ctrl+C sao chép ô/bảng đang chọn; nút Sao chép bảng lấy toàn bộ ma trận để dán vào Excel. Khi đang sửa ô, Ctrl+A/C chỉ áp dụng cho chữ trong ô.",
    "Matrix.AllSelected": "Đã chọn toàn bộ ma trận {0}",
    "Matrix.CopyingGrid": "Đang sao chép ma trận…",
    "Matrix.CopiedGrid": "Đã sao chép. Mở Excel, chọn ô bắt đầu và dán (Ctrl+V).",
    "Matrix.CellSize": "Kích thước ô",
    "Matrix.ResetCellSize": "Khôi phục hàng và cột mặc định",
    "Matrix.CellSizeHelp": "Áp dụng cho hàng và cột của ô đang chọn, không thay đổi giá trị ma trận. Có thể kéo ranh giới tiêu đề để chỉnh trực tiếp.",
    "Matrix.ColumnWidth": "Độ rộng cột: {0}",
    "Matrix.RowHeight": "Chiều cao hàng: {0}",
    "Matrix.ColumnWidthDecrease": "Giảm độ rộng cột đang chọn",
    "Matrix.ColumnWidthIncrease": "Tăng độ rộng cột đang chọn",
    "Matrix.RowHeightDecrease": "Giảm chiều cao hàng đang chọn",
    "Matrix.RowHeightIncrease": "Tăng chiều cao hàng đang chọn",
    "Matrix.ResultTitle": "Kết quả tính toán",
    "Matrix.ResultOperation": "Phép tính",
    "Matrix.ResultSize": "Kích thước kết quả C",
    "Matrix.ResultSizeValue": "{0} hàng × {1} cột",
    "Matrix.ResultDuration": "Thời gian tính",
    "Matrix.ResultMode": "Chế độ xử lý",
    "Matrix.ExactResult": "Kết quả số nguyên chính xác, không làm tròn.",
    "Matrix.TechnicalDetails": "Chi tiết kỹ thuật",
    "Matrix.Expanded": "Đang mở",
    "Matrix.Collapsed": "Đang thu gọn",
    "Matrix.UnderMillisecond": "Dưới 1 ms",
    "Matrix.Milliseconds": "{0} ms",
    "Matrix.Seconds": "{0} giây",
    "Matrix.SimdMode": "Tăng tốc SIMD",
    "Matrix.ScalarMode": "Thông thường (Scalar)",
    "Matrix.RecordedBackend": "Backend đã chạy: {0}",
    "Matrix.ResultStorage": "Kiểu dữ liệu kết quả: {0}",
    "Matrix.VectorBatches": "Số lượt tính vector: {0}",
    "Matrix.SelectResultCell": "Chọn Kết quả C, rồi chọn một ô trong bảng để xem các bước tính.",
    "Matrix.SolutionForCell": "Cách tính ô C[{0}, {1}]",
    "Matrix.ChooseRowColumn": "Chọn hàng và cột",
    "Matrix.RowColumnRule": "Lấy {2} phần tử ở hàng {0} của A và {2} phần tử ở cột {1} của B. Ghép các phần tử theo cùng thứ tự.",
    "Matrix.MultiplyElements": "Nhân các phần tử tương ứng",
    "Matrix.ProductPreview": "Dưới đây là {0} tích đầu trong {1} tích. Các tích còn lại được gộp thành tổng ở bước 3.",
    "Matrix.SumProducts": "Cộng các tích",
    "Matrix.LeadingSubtotal": "Tổng {0} tích đầu: {1}",
    "Matrix.RemainingSubtotal": "Tổng {0} tích còn lại: {1}",
    "Matrix.ChooseSamePosition": "Chọn phần tử cùng vị trí",
    "Matrix.SamePositionRule": "Lấy phần tử ở hàng {0}, cột {1} trong mỗi ma trận A và B.",
    "Matrix.SubstituteAndCalculate": "Thay số và tính",
    "Matrix.CellAnswer": "Kết quả của ô đang chọn",
    "Matrix.StepTitle": "Bước {0} · {1}",
    "Matrix.Title": "MA TRẬN",
    "Matrix.Subtitle": "Số nguyên • Cộng • Trừ • Nhân • Kết quả chính xác",
    "Matrix.Operation": "1. Chọn phép tính",
    "Matrix.Add": "Cộng A + B",
    "Matrix.Subtract": "Trừ A − B",
    "Matrix.Multiply": "Nhân A × B",
    "Matrix.DimensionsHelp": "Nhập số hàng và số cột riêng cho A, B, từ 1 đến 1024. Bấm Tạo ma trận để áp dụng kích thước.",
    "Matrix.IntegerHelp": "Mỗi ô nhận số nguyên Int64: −9223372036854775808 đến 9223372036854775807. Ô có dấu · là chưa nhập; dùng Điền ô trống bằng 0 nếu muốn. Không nhận số thập phân hoặc dấu phân nhóm.",
    "Matrix.Create": "Tạo ma trận",
    "Matrix.MatrixA": "Ma trận A",
    "Matrix.MatrixB": "Ma trận B",
    "Matrix.MatrixC": "Kết quả C",
    "Matrix.Rows": "Số hàng",
    "Matrix.Columns": "Số cột",
    "Matrix.Row": "Hàng",
    "Matrix.Column": "Cột",
    "Matrix.NavigationHelp": "Nhấp một lần để chọn ô, nhấp lại để sửa. Kéo ranh giới ở tiêu đề cột để đổi độ rộng, ở số hàng để đổi chiều cao. Enter/F2 mở sửa; khi sửa, Enter lưu và xuống hàng, Tab sang ô tiếp, Esc hủy. Thanh cuộn chỉ hiện khi bảng vượt khung nhìn; Shift + cuộn chuột để cuộn ngang.",
    "Matrix.Go": "Đi tới ô",
    "Matrix.Selected": "Ô {0}[{1}, {2}]",
    "Matrix.CellValue": "Giá trị đầy đủ của ô đang chọn",
    "Matrix.Apply": "Lưu và sang ô tiếp",
    "Matrix.Previous": "Ô trước",
    "Matrix.Next": "Ô tiếp",
    "Matrix.FillZero": "Điền ô trống bằng 0",
    "Matrix.Paste": "Dán bảng",
    "Matrix.Import": "Nhập CSV / TSV",
    "Matrix.Export": "Xuất kết quả CSV",
    "Matrix.Calculate": "Tính toán",
    "Matrix.Stop": "Dừng",
    "Matrix.CellSolution": "Lời giải của ô đang chọn",
    "Matrix.CellSolutionHelp": "Sau khi tính, chọn một ô trong C để xem công thức và giá trị đầy đủ.",
    "Matrix.BackendHelp": "Cộng/trừ cho kết quả Int128; nhân cho kết quả BigInteger. SIMD chỉ chạy khi cả hai chiều của A và B đều từ 16 trở lên và cài đặt tăng tốc cho phép. CPU SSE3–SSE4.2 hoặc AVX không có AVX2 dùng kernel SSE2; backend hiển thị là backend thực sự đã chạy.",
    "Matrix.TableHelp": "Bảng ma trận: nhấp một lần để chọn, nhấp lại để sửa. Kéo ranh giới tiêu đề cột hoặc số hàng để đổi kích thước. Thanh cuộn chỉ hiện ở chiều bị tràn. Dùng Hàng, Cột và Đi tới ô để chọn bằng bàn phím. Kết quả C chỉ đọc.",
    "Matrix.RowScroll": "Cuộn theo hàng",
    "Matrix.ColumnScroll": "Cuộn theo cột",
    "Matrix.VisibleFrom": "Đang xem từ hàng {0}, cột {1}",
    "Matrix.DraftStatus": "{0}: {1} × {2} • Đã nhập {3}/{4} ô",
    "Matrix.InvalidCell": "Ô {0}[{1}, {2}] phải là số nguyên trong phạm vi Int64, không có dấu phân nhóm hoặc phần thập phân.",
    "Matrix.InvalidCoordinate": "Nhập tọa độ trong phạm vi {0} hàng × {1} cột, bắt đầu từ 1.",
    "Matrix.InvalidDimensions": "Số hàng và số cột phải là số nguyên từ 1 đến 1024.",
    "Matrix.ReplaceAll": "Tạo lại sẽ xóa các ô đã nhập trong A và B cùng kết quả hiện tại. Tiếp tục?",
    "Matrix.Confirm": "Tiếp tục",
    "Matrix.Cancel": "Hủy",
    "Matrix.MissingCells": "Còn {0} ô trống trong A và {1} ô trống trong B. Hãy nhập đủ hoặc chọn Điền ô trống bằng 0 cho từng ma trận.",
    "Matrix.MultiplyShape": "Để nhân A × B, số cột của A phải bằng số hàng của B.",
    "Matrix.AddShape": "Để cộng hoặc trừ, A và B phải có cùng số hàng và số cột.",
    "Matrix.Execution": "C: {0} × {1} • Backend: {2} • {3} giây • Kiểu kết quả: {4}",
    "Matrix.Calculating": "Đang tính ma trận…",
    "Matrix.Completed": "Đã tính xong. Chọn một ô trong bảng Kết quả C để xem cách tính.",
    "Matrix.Cancelled": "Đã dừng. Dữ liệu đầu vào được giữ lại.",
    "Matrix.Failed": "Không thể hoàn tất thao tác. Kiểm tra dữ liệu hoặc thử lại.",
    "Matrix.ImportError": "Lỗi tại hàng {0}, cột {1}: {2}",
    "Matrix.Error.InvalidInteger": "Ô phải chứa một số nguyên Int64 hợp lệ.",
    "Matrix.Error.InvalidShape": "Bảng phải có số cột giống nhau trên mọi hàng; không để trống ô hoặc chèn hàng trống giữa bảng.",
    "Matrix.Error.TooLarge": "Dữ liệu vượt giới hạn 1024 × 1024 hoặc dung lượng cho phép.",
    "Matrix.Error.Empty": "Chưa có dữ liệu ma trận.",
    "Matrix.ClipboardEmpty": "Clipboard chưa có bảng số. Sao chép một vùng từ bảng tính trước khi dán.",
    "Matrix.Importing": "Đang đọc và kiểm tra bảng số…",
    "Matrix.AcceptImport": "Đã đọc bảng {1} × {2}. Thay toàn bộ ma trận {0} bằng bảng này? Kết quả cũ sẽ được xóa.",
    "Matrix.Imported": "Đã nhập ma trận. Kích thước đã cập nhật theo bảng dữ liệu.",
    "Matrix.Exporting": "Đang chuẩn bị file kết quả CSV…",
    "Matrix.Exported": "Đã lưu kết quả CSV.",
    "Calculation.Tabs.Matrix": "▦ Ma trận",
    "NumberTheory.PrimeMethod": "Method 1 · Prime factorization (grade 6)",
    "NumberTheory.EuclidMethod": "Method 2 · Euclid\u0027s algorithm",
    "NumberTheory.PrimeDecompose": "Write the number as a product of primes:",
    "NumberTheory.PrimeGcdRule": "Choose the COMMON prime factors, each with its SMALLEST exponent in the two factorizations. Their product is the GCD.",
    "NumberTheory.PrimeLcmRule": "Choose ALL prime factors appearing in either factorization, each with its LARGEST exponent. Their product is the LCM.",
    "NumberTheory.PrimeNoCommon": "There are no common prime factors, so the GCD is 1.",
    "NumberTheory.PrimeOne": "The number 1 has no prime factors. An empty product is taken to be 1.",
    "NumberTheory.PrimeZero": "Zero has no prime factorization. When an input is zero, use the special rules below.",
    "NumberTheory.PrimeUnfinished": "The remaining factor {0} has not been established to be prime; this factorization is incomplete.",
    "NumberTheory.PrimeUseEuclid": "For numbers with large factors, this factorization may remain incomplete. Use the Euclidean solution for the exact GCD/LCM.",
    "Calculation.Tabs.NumberTheory": "🔢 Number theory",
    "NumberTheory.Title": "NUMBER THEORY",
    "NumberTheory.Subtitle": "Greatest common divisor • Least common multiple • Worked steps",
    "NumberTheory.ChooseMode": "1. Choose a calculation",
    "NumberTheory.GcdButton": "🔢 Find GCD",
    "NumberTheory.LcmButton": "🔢 Find LCM",
    "NumberTheory.Gcd": "GCD",
    "NumberTheory.Lcm": "LCM",
    "NumberTheory.InputTitle": "2. Enter two numbers",
    "NumberTheory.InputHelp": "Enter two nonnegative integers, up to 128 digits each, without grouping separators. At least one number must be positive.",
    "NumberTheory.FirstNumber": "First number (a)",
    "NumberTheory.SecondNumber": "Second number (b)",
    "NumberTheory.InvalidFirst": "The first number must be a nonnegative integer of up to 128 digits, without grouping separators.",
    "NumberTheory.InvalidSecond": "The second number must be a nonnegative integer of up to 128 digits, without grouping separators.",
    "NumberTheory.BothZero": "At least one number must be positive. Change a or b.",
    "NumberTheory.SolutionTitle": "Detailed solution",